{
  "schema": "comparevi-history/agent-canary-policy@v1",
  "prIdentification": {
    "branchPrefix": "agent-canary/",
    "requiredLabels": [
      "agent-canary"
    ]
  },
  "targetContract": {
    "canonicalPath": "Tooling/comparevi-history-canary/CanaryProbe.vi",
    "expectedChangedViCount": 1,
    "expectedSelectedTargetCount": 1
  },
  "executionContract": {
    "expectedPublicModes": [
      "attributes",
      "front-panel",
      "block-diagram"
    ],
    "expectedNoisePolicy": "include",
    "expectedFullSurface": "artifact-index"
  },
  "publicationContract": {
    "stickyCommentRequired": true,
    "requiredStatus": "succeeded"
  },
  "promotionContract": {
    "mergePolicy": "manual-only",
    "prMode": "draft"
  },
  "reviewerSurfaceContract": {
    "previewManifestRequired": true,
    "requiredPreviewPublicationStatus": "succeeded",
    "maxCommentPreviewCards": 4,
    "requiredSurfaceKinds": [
      "front-panel",
      "block-diagram"
    ],
    "reviewerSummaryRequired": true,
    "changeDetailsRequired": true,
    "requiredMarkdownSections": [
      "## Workspace summary",
      "## Workspace navigation",
      "## Review workspace",
      "## Raw evidence inventory"
    ],
    "requiredHtmlMarkers": [
      "class=\"workspace-shell\"",
      "class=\"workspace-nav\"",
      "class=\"workspace-summary\"",
      "class=\"raw-evidence\""
    ],
    "surfaceReportLinksRequired": true,
    "signalReportLinksRequired": true,
    "changeDetailReportLinksRequired": true
  }
}
